{
  "$schema": "https://json-schema.org/draft/2020-12/schema",
  "$id": "https://phantom-protocol.io/crack/reference/schemas/attack_chain.schema.json",
  "title": "CRACK Attack Chain",
  "description": "Schema definition for CRACK attack chain artifacts.",
  "type": "object",
  "additionalProperties": false,
  "required": [
    "id",
    "name",
    "description",
    "version",
    "metadata",
    "difficulty",
    "time_estimate",
    "oscp_relevant",
    "steps"
  ],
  "properties": {
    "id": {
      "type": "string",
      "pattern": "^[a-z0-9]+-[a-z0-9]+-[a-z0-9]+-[a-z0-9]+$",
      "description": "Unique identifier following the {platform}-{category}-{technique}-{variant} convention."
    },
    "name": {
      "type": "string",
      "minLength": 1,
      "description": "Human readable attack chain name."
    },
    "description": {
      "type": "string",
      "minLength": 1,
      "description": "Concise overview of the chain's purpose and expected outcome."
    },
    "version": {
      "type": "string",
      "pattern": "^\\d+\\.\\d+\\.\\d+$",
      "description": "Semantic version for the attack chain definition (e.g. 1.0.0)."
    },
    "metadata": {
      "type": "object",
      "description": "Author and classification metadata for the attack chain.",
      "additionalProperties": false,
      "required": [
        "author",
        "created",
        "updated",
        "tags",
        "category"
      ],
      "properties": {
        "author": {
          "type": "string",
          "minLength": 1,
          "description": "Primary author or maintainer of the chain."
        },
        "created": {
          "type": "string",
          "format": "date",
          "description": "Date the chain was originally authored (YYYY-MM-DD)."
        },
        "updated": {
          "type": "string",
          "format": "date",
          "description": "Date the chain was last updated (YYYY-MM-DD)."
        },
        "tags": {
          "type": "array",
          "description": "Topical tags for filtering and discovery.",
          "items": {
            "type": "string",
            "minLength": 1
          },
          "minItems": 1,
          "uniqueItems": true
        },
        "category": {
          "type": "string",
          "minLength": 1,
          "description": "High-level classification of the chain (e.g. privilege_escalation)."
        },
        "platform": {
          "type": "string",
          "description": "Primary operating system or environment targeted by the chain."
        },
        "references": {
          "type": "array",
          "description": "External references or documentation links.",
          "items": {
            "type": "string",
            "format": "uri"
          }
        }
      }
    },
    "difficulty": {
      "type": "string",
      "enum": [
        "beginner",
        "intermediate",
        "advanced",
        "expert"
      ],
      "description": "Relative difficulty of executing the chain end-to-end."
    },
    "time_estimate": {
      "type": "string",
      "pattern": "^\\d+\\s*(minutes?|hours?|days?)$",
      "description": "Estimated time required to complete the chain (e.g. '45 minutes')."
    },
    "oscp_relevant": {
      "type": "boolean",
      "description": "Whether the chain is relevant to OSCP preparation and assessment."
    },
    "prerequisites": {
      "type": "array",
      "description": "Preconditions that must be satisfied before executing the chain.",
      "items": {
        "type": "string",
        "minLength": 1
      },
      "uniqueItems": true
    },
    "notes": {
      "type": "string",
      "description": "Additional free-form notes about the chain."
    },
    "steps": {
      "type": "array",
      "description": "Ordered list of steps that compose the attack chain.",
      "minItems": 1,
      "items": {
        "$ref": "#/definitions/chain_step"
      }
    }
  },
  "definitions": {
    "chain_step": {
      "type": "object",
      "additionalProperties": false,
      "required": [
        "name",
        "objective",
        "command_ref"
      ],
      "properties": {
        "id": {
          "type": "string",
          "pattern": "^[a-z0-9]+(?:-[a-z0-9]+)*$",
          "description": "Optional identifier for referencing the step within the chain."
        },
        "name": {
          "type": "string",
          "minLength": 1,
          "description": "Short descriptive title for the step."
        },
        "objective": {
          "type": "string",
          "minLength": 1,
          "description": "Goal that this step aims to achieve."
        },
        "description": {
          "type": "string",
          "description": "Detailed instructions or narrative for the step."
        },
        "command_ref": {
          "type": "string",
          "pattern": "^[a-z0-9]+(?:-[a-z0-9]+)*$",
          "description": "Identifier of the command referenced by this step."
        },
        "evidence": {
          "type": "array",
          "description": "Artifacts or outputs expected from successful execution.",
          "items": {
            "type": "string",
            "minLength": 1
          }
        },
        "dependencies": {
          "type": "array",
          "description": "IDs of steps that must be completed before this step can begin.",
          "items": {
            "type": "string",
            "pattern": "^[a-z0-9]+(?:-[a-z0-9]+)*$"
          },
          "uniqueItems": true
        },
        "repeatable": {
          "type": "boolean",
          "description": "Whether the step can be repeated multiple times within the chain."
        },
        "success_criteria": {
          "type": "array",
          "description": "Indicators confirming the step succeeded.",
          "items": {
            "type": "string",
            "minLength": 1
          }
        },
        "failure_conditions": {
          "type": "array",
          "description": "Common failure modes and how to detect them.",
          "items": {
            "type": "string",
            "minLength": 1
          }
        },
        "next_steps": {
          "type": "array",
          "description": "Recommended follow-up actions or branches after completing the step.",
          "items": {
            "type": "string",
            "pattern": "^[a-z0-9]+(?:-[a-z0-9]+)*$"
          }
        }
      }
    }
  }
}
