{
  "id": "linux-privesc-suid-basic",
  "name": "SUID Binary Privilege Escalation (Basic)",
  "description": "Exploit misconfigured SUID binary using GTFOBins to gain root shell",
  "version": "1.0.0",
  "metadata": {
    "author": "CRACK Development Team",
    "created": "2025-10-13",
    "updated": "2025-10-13",
    "tags": [
      "OSCP",
      "LINUX",
      "PRIVILEGE_ESCALATION",
      "SUID",
      "GTFOBINS",
      "QUICK_WIN"
    ],
    "category": "privilege_escalation",
    "platform": "linux",
    "references": [
      "https://gtfobins.github.io/",
      "https://book.hacktricks.xyz/linux-unix/privilege-escalation#suid"
    ]
  },
  "difficulty": "beginner",
  "time_estimate": "15 minutes",
  "oscp_relevant": true,
  "prerequisites": [
    "Shell access as low-privilege user (www-data, user, etc.)",
    "Target system is Linux"
  ],
  "notes": "SUID binaries with setuid bit set run with owner's privileges (usually root). Misconfigured binaries like find, vim, nmap, base64 can be exploited for privilege escalation. GTFOBins provides exploitation techniques. This chain covers the most common OSCP scenario: finding SUID binary and exploiting it for root shell.",
  "steps": [
    {
      "id": "find-suid",
      "name": "Enumerate SUID Binaries",
      "objective": "Locate all SUID binaries on system using find command",
      "description": "Search entire filesystem for files with SUID bit set (-perm -4000). Redirect errors to /dev/null to avoid permission denied noise.",
      "command_ref": "find-suid-binaries",
      "evidence": [
        "List of SUID binary paths",
        "Binaries owned by root",
        "Custom or unusual SUID binaries visible"
      ],
      "success_criteria": [
        "Find command executes without errors",
        "At least 10-20 SUID binaries discovered",
        "Results include non-standard binaries (not just passwd, sudo, ping)"
      ],
      "failure_conditions": [
        "Find command syntax error",
        "All directories permission denied (wrong user context)",
        "No results returned (unlikely on real system)"
      ]
    },
    {
      "id": "filter-interesting",
      "name": "Identify Exploitable SUID Binaries",
      "objective": "Filter out standard system binaries and focus on exploitable candidates",
      "description": "Exclude common system binaries (passwd, sudo, ping, mount) that are expected to have SUID. Look for: find, vim, nmap, base64, less, more, python, perl, awk, etc.",
      "command_ref": "filter-suid-binaries",
      "dependencies": [
        "find-suid"
      ],
      "evidence": [
        "Shortened list of interesting binaries",
        "GTFOBins-listed binaries identified",
        "Custom application binaries"
      ],
      "success_criteria": [
        "Filtered list contains 1-5 interesting binaries",
        "At least one binary has known GTFOBins technique",
        "Binaries are executable by current user"
      ],
      "failure_conditions": [
        "No interesting binaries remain after filtering",
        "All binaries are standard system tools",
        "Binaries require specific conditions not present"
      ]
    },
    {
      "id": "check-gtfobins",
      "name": "Lookup GTFOBins Exploitation Technique",
      "objective": "Find exploitation technique for discovered SUID binary on GTFOBins website",
      "description": "Visit https://gtfobins.github.io/ and search for binary name. Look for 'SUID' section specifically. Copy exploitation command syntax.",
      "command_ref": "gtfobins-suid-lookup",
      "dependencies": [
        "filter-interesting"
      ],
      "evidence": [
        "GTFOBins page loaded",
        "SUID section present for binary",
        "Exploitation command documented"
      ],
      "success_criteria": [
        "Binary has GTFOBins entry",
        "SUID exploitation technique documented",
        "Command syntax is clear and testable"
      ],
      "failure_conditions": [
        "Binary not listed on GTFOBins",
        "No SUID section for binary",
        "Technique requires additional prerequisites"
      ]
    },
    {
      "id": "exploit-suid",
      "name": "Execute SUID Exploitation",
      "objective": "Run GTFOBins command to escalate privileges and spawn root shell",
      "description": "Execute exploitation command exactly as documented on GTFOBins. Common example: /usr/bin/find . -exec /bin/bash -p \\; -quit",
      "command_ref": "execute-suid-exploit-find",
      "dependencies": [
        "check-gtfobins"
      ],
      "evidence": [
        "Command executes without errors",
        "Shell prompt changes to root indicator",
        "Elevated privileges confirmed"
      ],
      "success_criteria": [
        "Root shell spawned (# prompt)",
        "whoami returns 'root'",
        "id shows uid=0(root) or euid=0(root)"
      ],
      "failure_conditions": [
        "Permission denied error",
        "Binary not found (wrong path)",
        "Shell spawns but not privileged (missing -p flag for bash)"
      ],
      "next_steps": [
        "verify-root"
      ]
    },
    {
      "id": "verify-root",
      "name": "Verify Root Access",
      "objective": "Confirm effective UID is 0 and full root privileges obtained",
      "description": "Run whoami and id commands to verify root access. Check if you can read /etc/shadow or /root/ directory.",
      "command_ref": "verify-root-access",
      "dependencies": [
        "exploit-suid"
      ],
      "evidence": [
        "whoami output: root",
        "id output: uid=0(root) gid=0(root) or euid=0(root)",
        "Can access /etc/shadow",
        "Can list /root/ directory"
      ],
      "success_criteria": [
        "Effective UID is 0",
        "Root filesystem access confirmed",
        "Can read sensitive files"
      ],
      "failure_conditions": [
        "UID is not 0 (privilege escalation failed)",
        "Cannot access root-only files",
        "Effective UID differs from real UID (may need -p flag)"
      ]
    }
  ]
}
